{
    "$id": "https://raw.githubusercontent.com/IntersectMBO/cardano-config/v2/schemas/LocalConnectionsConfig.schema.json",
    "$schema": "http://json-schema.org/draft-07/schema#",
    "description": "LocalConnectionsConfig",
    "properties": {
        "$schema": {
            "default": "https://raw.githubusercontent.com/IntersectMBO/cardano-config/v2/schemas/LocalConnectionsConfig.schema.json",
            "description": "URL of the JSON Schema this LocalConnectionsConfig file follows (the $schema annotation), for editors and validators. Pinned to the vN tag of the format version it describes.",
            "title": "$schema",
            "type": "string"
        },
        "EnableGrpc": {
            "default": false,
            "description": "Whether to enable the gRPC server",
            "title": "EnableGrpc",
            "type": "boolean"
        },
        "GrpcListenAddress": {
            "description": "IP address (IPv4 or IPv6) the gRPC server binds to. Requires GrpcListenPort. Defaults to 127.0.0.1",
            "title": "GrpcListenAddress",
            "type": "string"
        },
        "GrpcListenPort": {
            "description": "TCP port the gRPC server listens on. When set, the gRPC server listens over HTTP/2 rather than on a unix socket, without TLS unless GrpcTlsCertificateFile is also given. Mutually exclusive with GrpcSocketPath",
            "maximum": 65535,
            "minimum": 0,
            "title": "GrpcListenPort",
            "type": "integer"
        },
        "GrpcSocketPath": {
            "description": "Path of the gRPC server socket. Mutually exclusive with GrpcListenPort",
            "format": "path",
            "title": "GrpcSocketPath",
            "type": "string"
        },
        "GrpcTlsCertificateFile": {
            "description": "Path of the gRPC server's TLS certificate (PEM). Enables TLS; requires GrpcTlsPrivateKeyFile and GrpcListenPort",
            "format": "path",
            "title": "GrpcTlsCertificateFile",
            "type": "string"
        },
        "GrpcTlsChainCertificateFiles": {
            "description": "Paths of the intermediate certificates to include in the gRPC server's TLS chain (PEM)",
            "items": {
                "format": "path",
                "type": "string"
            },
            "title": "GrpcTlsChainCertificateFiles",
            "type": "array"
        },
        "GrpcTlsPrivateKeyFile": {
            "description": "Path of the private key matching GrpcTlsCertificateFile (PEM)",
            "format": "path",
            "title": "GrpcTlsPrivateKeyFile",
            "type": "string"
        },
        "SocketPath": {
            "description": "Path of the socket for local clients",
            "format": "path",
            "title": "SocketPath",
            "type": "string"
        }
    },
    "title": "LocalConnectionsConfig",
    "type": "object"
}
